{"protocol_version":"1.0","session_id":"SES-PROJECT-1","project_id":"PRJ-1","session_type":"PROJECT_MAIN","opencode_session_id":"oc-session-1","workspace_path":"D:\\workspace\\project-1","stage":"REQUIREMENT","state":"ACTIVE","todo_authority":"OPENCODE_NATIVE","created_at":"2026-08-06T10:00:00Z","updated_at":"2026-08-06T10:00:00Z"}
